{
  "run_metadata": {
    "run_id": "brand-dna-2026-02-06",
    "timestamp_utc": "2026-02-06T16:27:35+00:00",
    "config": {
      "run_id": "brand-dna-2026-02-06",
      "timestamp_utc": "2026-02-06T16:27:35+00:00",
      "blend_mode": "harmonise",
      "weights": {
        "amp": 0.16666666666666666,
        "coinshift": 0.16666666666666666,
        "parallel": 0.16666666666666666,
        "every": 0.16666666666666666,
        "firecrawl": 0.16666666666666666,
        "raycast": 0.16666666666666666
      },
      "inputs": {
        "inspiration_file": "docs/02-guidelines/inspiration/brand-dna-2026-02-06/brand-apps-inspiration.md",
        "selection_file": "docs/02-guidelines/inspiration/brand-dna-2026-02-06/.probe/brand-dna-2026-02-06/selection.json"
      },
      "sources": {
        "firecrawl": {
          "pages_scraped": 7
        },
        "parallel": {
          "pages_extracted": 23
        },
        "browser_probe": {
          "pages_probed": 8,
          "viewports": [
            "desktop",
            "mobile"
          ],
          "media_modes": [
            "light",
            "dark"
          ],
          "states": [
            "base",
            "hover",
            "focus"
          ],
          "probe_script": ".agents/skills/00-utilities/brand-dna-extractor/scripts/probe_css.js"
        }
      }
    }
  },
  "per_site_tokens": [
    {
      "site_id": "amp",
      "weight": 0.16666666666666666,
      "confidence": 0.75,
      "needs_human_review": false,
      "tokens": {
        "colour": {
          "primary": "#DFDFC1",
          "secondary": "#D0D0B4",
          "accent": "#171917",
          "background": "#DFDFC1",
          "text": "#0B0D0B"
        },
        "typography": {
          "body": {
            "font_family": "system-ui, -apple-system, \"system-ui\", \"Segoe UI\", Roboto, sans-serif",
            "font_size": "13px",
            "line_height": "20px",
            "font_weight": "400"
          },
          "headings": {
            "font_family": "\"Sagittaire Display\", serif",
            "h1_size": "75.84px",
            "letter_spacing": "-4.5504px",
            "font_weight": "400"
          },
          "ui": {
            "monospace": "Berkeley Mono"
          }
        },
        "spacing": {
          "step": 4,
          "scale": [
            4,
            8,
            12,
            16,
            24,
            32,
            48,
            64
          ]
        },
        "radius": {
          "scale": [
            2,
            4,
            6
          ]
        },
        "elevation": {
          "shadows": []
        },
        "motion": {
          "transition_durations_ms": [
            150
          ],
          "timing_functions": [
            "cubic-bezier(0.4, 0, 0.2, 1)"
          ],
          "notes": []
        },
        "voice": {
          "traits": [
            "modern",
            "medium energy",
            "developer-first",
            "direct"
          ]
        },
        "components": {
          "buttonPrimary": {
            "background": "#171917",
            "textColor": "#FAFAF8",
            "borderRadius": "6px",
            "borderRadiusCorners": {
              "topLeft": "6px",
              "topRight": "6px",
              "bottomRight": "6px",
              "bottomLeft": "6px"
            },
            "shadow": "none"
          }
        }
      },
      "evidence_map": {
        "voice.traits": [
          {
            "type": "excerpt",
            "page_url": "https://ampcode.com/",
            "excerpt": "Amp is a frontier coding agent that lets you wield the full power of leading models.",
            "path_or_url": "docs/02-guidelines/inspiration/brand-dna-2026-02-06/.firecrawl/brand-dna-2026-02-06/scrape/amp/home.json"
          }
        ],
        "colour.primary": [
          {
            "type": "excerpt",
            "page_url": "https://ampcode.com/",
            "excerpt": "branding.colors.primary = #DFDFC1",
            "path_or_url": "docs/02-guidelines/inspiration/brand-dna-2026-02-06/.firecrawl/brand-dna-2026-02-06/scrape/amp/home.json"
          }
        ],
        "colour.accent": [
          {
            "type": "excerpt",
            "page_url": "https://ampcode.com/",
            "excerpt": "branding.colors.accent/link = #171917",
            "path_or_url": "docs/02-guidelines/inspiration/brand-dna-2026-02-06/.firecrawl/brand-dna-2026-02-06/scrape/amp/home.json"
          }
        ],
        "colour.background": [
          {
            "type": "computed_style",
            "page_url": "https://ampcode.com/",
            "selector": "body",
            "property": "background-color",
            "value": "rgb(223, 223, 193)",
            "viewport": "desktop",
            "media_mode": "light",
            "state": "base"
          }
        ],
        "colour.text": [
          {
            "type": "computed_style",
            "page_url": "https://ampcode.com/",
            "selector": "body",
            "property": "color",
            "value": "rgb(11, 13, 11)",
            "viewport": "desktop",
            "media_mode": "light",
            "state": "base"
          }
        ],
        "typography.body.font_family": [
          {
            "type": "computed_style",
            "page_url": "https://ampcode.com/",
            "selector": "body",
            "property": "font-family",
            "value": "system-ui, -apple-system, \"system-ui\", \"Segoe UI\", Roboto, sans-serif",
            "viewport": "desktop",
            "media_mode": "light",
            "state": "base"
          }
        ],
        "typography.headings.font_family": [
          {
            "type": "computed_style",
            "page_url": "https://ampcode.com/",
            "selector": "h1",
            "property": "font-family",
            "value": "\"Sagittaire Display\", serif",
            "viewport": "desktop",
            "media_mode": "light",
            "state": "base"
          }
        ],
        "motion.transition_durations_ms": [
          {
            "type": "computed_style",
            "page_url": "https://ampcode.com/",
            "selector": "[data-brandprobe=\"primary-cta\"]",
            "property": "transition-duration",
            "value": "0.15s",
            "viewport": "desktop",
            "media_mode": "light",
            "state": "base"
          }
        ],
        "motion.timing_functions": [
          {
            "type": "computed_style",
            "page_url": "https://ampcode.com/",
            "selector": "[data-brandprobe=\"primary-cta\"]",
            "property": "transition-timing-function",
            "value": "cubic-bezier(0.4, 0, 0.2, 1)",
            "viewport": "desktop",
            "media_mode": "light",
            "state": "base"
          }
        ],
        "spacing.step": [
          {
            "type": "computed_style",
            "page_url": "https://ampcode.com/",
            "selector": "[data-brandprobe=\"primary-cta\"]",
            "property": "padding",
            "value": "4px 10px",
            "viewport": "desktop",
            "media_mode": "light",
            "state": "base"
          }
        ],
        "radius.scale": [
          {
            "type": "computed_style",
            "page_url": "https://ampcode.com/",
            "selector": "[data-brandprobe=\"primary-cta\"]",
            "property": "border-radius",
            "value": "4px",
            "viewport": "desktop",
            "media_mode": "light",
            "state": "base"
          }
        ],
        "motion.hover_diff": [
          {
            "type": "computed_style_diff",
            "page_url": "https://ampcode.com/",
            "selector": "[data-brandprobe=\"primary-cta\"]",
            "property": "color",
            "from": "oklab(0.155891 -0.00437056 0.00303265 / 0.8)",
            "to": "rgb(11, 13, 11)",
            "viewport": "desktop",
            "media_mode": "light",
            "state": "hover"
          }
        ],
        "components.buttonPrimary.background": [
          {
            "type": "excerpt",
            "page_url": "https://ampcode.com/",
            "excerpt": "branding.components.buttonPrimary.background = #171917",
            "path_or_url": "docs/02-guidelines/inspiration/brand-dna-2026-02-06/.firecrawl/brand-dna-2026-02-06/scrape/amp/home.json"
          }
        ],
        "components.buttonPrimary.borderRadius": [
          {
            "type": "excerpt",
            "page_url": "https://ampcode.com/",
            "excerpt": "branding.components.buttonPrimary.borderRadius = 6px",
            "path_or_url": "docs/02-guidelines/inspiration/brand-dna-2026-02-06/.firecrawl/brand-dna-2026-02-06/scrape/amp/home.json"
          }
        ],
        "elevation.shadows": [
          {
            "type": "excerpt",
            "page_url": "https://ampcode.com/",
            "excerpt": "No prominent shadows detected in sampled elements.",
            "path_or_url": "docs/02-guidelines/inspiration/brand-dna-2026-02-06/.firecrawl/brand-dna-2026-02-06/scrape/amp/home.json"
          }
        ]
      }
    },
    {
      "site_id": "coinshift",
      "weight": 0.16666666666666666,
      "confidence": 0.75,
      "needs_human_review": false,
      "tokens": {
        "colour": {
          "primary": "#F0F8FF",
          "secondary": "#FEFDFC",
          "accent": "#FA3812",
          "background": "#FEFDFC",
          "text": "#000000"
        },
        "typography": {
          "body": {
            "font_family": "\"ABC ROM\", sans-serif",
            "font_size": "16px",
            "line_height": "20.8px",
            "font_weight": "400"
          },
          "headings": {
            "font_family": "\"ABC ROM\", sans-serif",
            "h1_size": "82px",
            "letter_spacing": "-3.28px",
            "font_weight": "400"
          },
          "ui": {